52,"EM1161_00_0","Herbivore","Rafma","Herbivores that live in herds in cold areas.
They are targeted by predators as a source of
sustenance where flora and fauna are scarce.","Alpha Rafma","Herbivores that live primarily in cold regions.
The larger alphas protect the herd, and can be
harvested for paralytic Slinger ammo.","","","","92EFFDE5-6D8C-490E-85B9-39F8C79E2267","Herbivores that live primarily in cold
regions. Rafma form herds with a large alpha
at the head. When threatened, the alpha
discharges static energy stored in its horn
to shock foes and defend the herd. This horn
can also be targeted with the Hook Slinger
to get paralytic ammo. Rafma have been
sighted moving along dizzyingly steep
cliffsides, to the wonderment of observers.","","F4A6866F-A637-4B1D-9C95-A8932B850402","","5FDE058F-5BAD-4CF4-B9B6-0ACD930D8B56","","E7F770F9-A975-4815-91FB-938775CA1B2C","","00000000","",CellImage,"","","","I_NONE",true,false,false,false,"INVALID","EM_ZAKO","EXCEPT_BATTLE","GET"
53,"EM1162_00_0","Bird Wyvern","Porkeplume","Bird wyverns with sharp bristles on their heads.
Obtain Slinger ammo that is effective at creating
wounds by firing your Hook Slinger at them.","","","","","","FEC607A2-7A53-4771-AE8E-09744BBA29B9","Bird wyverns that live in herds at the heart
of the Ruins of Wyveria. Porkeplumes are
extremely timid and will protect themselves
against threats by puffing out the bristles
on their heads. If the situation escalates,
a member of the herd will slam into the foe
with its bristles, giving the other members
a window to escape. The head bristles can be
used as bleeding pods for the Slinger.","","FA2643EB-E655-4B5A-95E8-B525EBA74EA4","","655DFD1B-3337-479D-B32F-C847BED1D8A0","","A31F3A55-53D8-4BA5-8790-C628BD369AC9","","00000000","",CellImage,"","","","I_NONE",true,false,false,false,"INVALID","EM_ZAKO","EXCEPT_BATTLE","GET"
54,"EM1163_00_0","Temnoceran","Nerscylla Hatchling","Newly-hatched Nerscylla larvae. They form colonies
in the bodies of devoured prey, nests, and other
hidey-holes, and react as a group when provoked.","","","","","","E80B78C3-1208-4C80-A998-C92943E803A8","The larval form of a temnoceran that
inhabits the Iceshard Cliffs. At this stage,
they cannot use webbing or status ailments
like adult Nerscylla, but these little fellows
like to gang up, surround prey, and then
pounce all at once.","","BDF3E978-1B6F-4633-9747-70CD6D88EC5A","","5A4FCCFF-1C50-4EFA-94C6-579D564C74FF","","89C62832-5D4B-4057-8074-5CAE7897D75A","","00000000","",CellImage,"","","","I_NONE",true,false,false,false,"INVALID","EM_ZAKO","NONE","GET"
55,"EM1164_50_0","Construct","Guardian Seikret","Artificial wyverns created by an ancient
civilization. They hatch from small cocoons and
travel in packs, attacking with sharp claws.","","","","","","B297E21D-1C5F-4A86-AF85-D7ED18DC8BA6","Artificial wyverns created by an ancient
civilization. They dash through the Ruins
of Wyveria in search of Wyvern Milk, their
source of energy. Unlike the original
Seikret, the Guardian types are aggressive
and have sharp, dangerous claws on their
unique forelegs. They generally travel in
packs of two or three, but if threatened,
they may call for more help and try to
surround the adversary.","","BE2B1CA0-C06E-4A7B-8E82-1072180CE7AE","","050BB776-5327-48DF-A014-F0EFDA4293AA","","A6C43F62-047B-49C2-B877-F4B9A2EA849E","","00000000","",CellImage,"","","","I_NONE",true,false,false,false,"INVALID","EM_ZAKO","NONE","GET"
57,"EM5001_00_0","","Paratoad","Toads containing a paralytic gas. Hitting them
will release the gas, which is powerful enough
to stop large monsters in their tracks.","","","","","","DADE7AC4-33FE-4C2E-A8C7-B1974995FC6D","","","D3CF1400-5EBC-4625-851F-E373EE163D63","Toads that contain a powerful, paralytic gas
which they can use as a defensive measure
to stop threats in their tracks.","16D56CF2-799C-41B7-9F70-9E587B029510","Toads containing a paralytic gas that are
usually found by the water. They are
sensitive to force and will release the
gas as a defensive measure; it's powerful
enough to stop hunters and large monsters in
their tracks, which buys the Paratoad time
to escape. Hunters can use this behavior to
direct the gas at a desired target and gain
the upper hand.","253AA2AD-E877-4D74-9DD0-DB68446B00A2","","00000000","","","",CellImage,CellImage,"I_LEMON",true,false,false,false,"INVALID","ENVIRONMENT_TRAP","ALWAYS","INSTANT"
58,"EM5001_10_0","","Nitrotoad","When struck, Nitrotoads release a spray
of volatile liquid that detonates with enough
power to stagger even large monsters.","","","","","","9D77C833-B628-427A-A48D-0FA8B29993D4","","","8440BDBB-B660-4294-9E70-A0CE9A030D1D","A toad that stores an explosive liquid within
its body. The explosions it produces are so
strong they even make larger monsters flinch.","A8216B5F-5577-4F2F-8D2F-A5EF41B27C7A","Toads that store an explosive liquid within
their bodies. Any physical stimulus causes
them to spray this liquid and flee. Once
the liquid contacts the air, it detonates,
wreaking havoc. Though these creatures
prefer to live in environments abounding in
combustible materials like coal, their diet
actually consists mostly of insects and
crustaceans. It is yet unknown what causes
them to produce the explosive liquid.","7FA47FEA-A2C5-47DB-829D-41C2DB3160DD","","00000000","","","",CellImage,CellImage,"I_RED",true,false,false,false,"INVALID","ENVIRONMENT_TRAP","ALWAYS","INSTANT"
59,"EM5001_20_0","","Sleeptoad","Toads that store sleeping gas in their bodies.
A shock will cause them to spray the gas, which
is potent enough to affect monsters.","","","","","","D627F089-CCF8-484A-8284-109EE00883E5","","","17717459-8AA9-4C0A-9A30-5EB99F491A16","Toads that store a potent gas in their
bodies that can put monsters to sleep.","0663EAC5-6EDD-4970-AD15-2125C0084D36","Toads that store sleeping gas in their
bodies. A shock will cause them to spray the
gas, putting the enemy to sleep while they
escape. The gas is so potent that it affects
hunters and even large monsters. You may
be able to gain the upper hand if you use
this to your advantage and direct the gas
at a monster.","E8C6B998-B9D5-4841-9905-B7D1E8409404","","00000000","","","",CellImage,CellImage,"I_BLUE",true,false,false,false,"INVALID","ENVIRONMENT_TRAP","ALWAYS","INSTANT"
60,"EM5002_00_0","","Vigorwasp","Insects that carry restorative nectar.
A light impact causes the nectar to scatter,
producing a continual healing effect.","","","","","","ABECAF70-B043-48D8-B98B-6E2C75FD7F7A","","","A9D35CE6-478B-4B1E-BFE7-DA5E880D36B4","Insects that gather restorative nectar from
Vitalilies and store it, with more or less
the same properties, in their abdomens.","00F7A379-E7B9-49FA-9175-D70571515244","Insects that gather restorative nectar from
Vitalilies and store it in their abdomens.
While the flowers and nectar have similar
properties, the latter can be scattered in
large quantities to produce a lingering,
continual healing effect. There's a rise
in the Vigorwasp population during
the Plenty, when Vitalilies flourish.","4F2B8812-34B5-4FAE-A9EA-4823DFE7A746","","00000000","","","",CellImage,CellImage,"I_SGREEN",true,false,false,false,"INVALID","ENVIRONMENT_TRAP","ALWAYS","INSTANT"
61,"EM5002_01_0","","Giant Vigorwasp","Large wasps that carry more nectar at a higher
concentration. A light impact scatters the
nectar, producing a continual healing effect.","","","","","","B82BF37C-47A6-420F-9E88-3C5811575E53","","","E913D7AF-5266-4332-9013-E577B4060F66","Large wasps that carry more nectar at
a higher concentration. Frequently seen
during the Plenty.","D8275325-3C30-4B5B-B299-25DBB0E59B23","Large wasps that carry more nectar at a
higher concentration. This boosts the range
and potency of the nectar's restorative
effects. They are most prevalent during the
Plenty, when the Vigorwasps have learned
the nectar will be more plentiful. They are
sometimes sighted in groups.","83E8D550-2D8F-4521-B9E7-03EF2F41EF03","","00000000","","","",CellImage,CellImage,"I_GREEN",true,false,false,false,"INVALID","ENVIRONMENT_TRAP","ALWAYS","INSTANT"
62,"EM5002_10_0","","Purewasp","Insects that store nectar. An impact will cause
them to release it, providing immediate health
recovery and relief from status ailments.","","","","","","DF96224D-9667-44D8-BC16-21EC21F722E2","","","C76E8487-0B9E-4154-A219-37F0D116CF2A","Insects that store nectar in their abdomens
with restorative, detoxifying, and
deodorizing properties.","BEEB0E78-83FF-4D09-BBC6-ED219D5124E1","Insects that store nectar in their
abdomens with restorative, detoxifying,
and deodorizing properties. Since the
effects are different from a Vigorwasp's,
it is believed that this species collects
ingredients from medicinal plants other
than Vitalilies. However, based on ongoing
research, it has been found that enzymes
in their bodies could also play a role.","D9FE151D-BA98-4409-8798-D336343B904E","","00000000","","","",CellImage,CellImage,"I_SKY",true,false,false,false,"INVALID","ENVIRONMENT_TRAP","ALWAYS","INSTANT"
63,"EM5003_00_0","","Flashflies","Insects that flash when struck. The larger their
colony, the brighter they shine. They can be
used to blind large monsters.","","","","","","3A6B8A21-487C-4D6E-8BD7-73F5E9FA43A5","","","E2529552-E37C-45B8-B806-0DD6A8732E55","Insects that flash when struck. Alone, their
light is faint, but in colonies they shine
more intensely.","FD548852-C4BB-412B-94C7-3F46A24BC305","Insects that flash when struck. Usually,
they live solitary existences with too faint
a flicker to even notice. In caves or the
dark of night, they form colonies where
their light is more intense; striking them
causes them to shine even brighter. On hunts,
they can be used like flash bombs to blind
and disorient monsters.","709C92BE-297A-4485-B6D3-6E47B78DC854","","00000000","","","",CellImage,CellImage,"I_YELLOW",true,false,false,false,"INVALID","ENVIRONMENT_TRAP","ALWAYS","INSTANT"
64,"EM5004_00_0","","Dung Beetle","Insects that habitually roll up monster dung.
The dung pods are well compacted and can
be used as Slinger ammo.","","","","","","76626095-A057-42B5-BC08-67807179D730","","","43556E97-47F1-4FD0-8432-BFEB421DA8D7","Insects that habitually roll up monster dung:
nature's diligent decomposers. The dung pods
can be used as Slinger ammo.","0A4F4479-C2D7-4563-A0BB-3F006A624276","Insects that habitually roll up monster
dung. They bring it back to their
underground nests not just for food, but to
lay eggs on and feed their larvae. They're
the faces of feces across the land: nature's
diligent decomposers. The compacted dung
pods formed by their efforts can be used as
Slinger ammo. It's foul enough to send even
large monsters running for fresh air—a
useful trick when you're outnumbered.","1AC40A0A-06A8-4A38-9E39-329174D9CC5D","","00000000","","","",CellImage,CellImage,"I_BROWN",true,false,false,false,"INVALID","SLINGER","ALWAYS","GET"
65,"EM5004_10_0","","Bomb Beetle","An insect that rolls explosive rocks and
brings them back to its nest. These rocks
can be used as Slinger ammo.","","","","","","76FFD723-1F2E-426E-90BD-5AC53615ACBF","","","0C8A4354-BFA7-465C-B9DC-45469C8876FA","An insect that rolls explosive rocks and
brings them back to its nest. These rocks
can be used as Slinger ammo.","C67C93F8-6DA0-42D8-9CC4-2C87B5CF3983","Beetles that roll around explosive rocks.
Because both these rocks and their habitat
are extremely hot, their bodies have evolved
to withstand heat. It's yet unclear what
they do with the rocks once they get back to
their nests, but some theorize that they are
fed to the beetles' young.","F843F22C-B8CE-4F93-B40E-E1B31EF7F3DD","","00000000","","","",CellImage,CellImage,"I_RED",true,false,false,false,"INVALID","SLINGER","ALWAYS","GET"
66,"EM5004_20_0","","Rime Beetle","Beetles that gather up snowballs and roll them
back to their nests. The snowballs can be used
as Slinger frostburst ammo.","","","","","","460036C0-1C3C-4F30-9909-C0361E78131D","","","8104F531-2AFA-4022-8901-0640B678FFAD","Insects that roll balls of snow until they
harden. These ice balls can be used as
Slinger ammo.","478D9FE5-E3E7-4445-8C60-A6247201388B","Beetles that gather up snow. Their snowballs
can be used as Frostburst Ammo. Due to their
ecology, Icebeetles are limited to cold
habitats and are more tolerant of cold than
other insects. No one knows why they roll
their snowballs back to their nests. Some
theorize it's to grow the organic matter
they feed on, while others think it could be
related to reproductive behavior.","2EF26264-1A86-48B8-90FF-E09A582FF667","","00000000","","","",CellImage,CellImage,"I_BLUE",true,false,false,false,"INVALID","SLINGER","ALWAYS","GET"
67,"EM5005_00_0","","Vigormantle Bug","Insects that wear healing herbs like cloaks,
producing a restorative nectar that can be
collected from them using the Hook Slinger.","","","","","","1BA575EA-6F0B-4C0C-B172-DCC776B5A521","","","15F619D1-6BDD-4693-9FC8-445A72A1B83B","Insects that wear healing herbs like cloaks.
The cloak serves a double purpose: to store
nutrients and to defend against predators.","AC0B2555-6D64-45B6-A23E-37A61657868B","Insects that wear healing herbs like
cloaks, initiating a fermentation process
that creates a nectar with similar
restorative properties. Collecting the
cloak by hand or with the Hook Slinger
will restore health. The cloak stores
nutrients but can be shed in a pinch as
a distraction to defend against predators.","DF9381DD-6B52-402D-B729-68CE6BFE40B7","","00000000","","","",CellImage,CellImage,"I_GREEN",true,false,false,false,"INVALID","ENVIRONMENT_TRAP","ALWAYS","INSTANT"
68,"EM5005_10_0","","Chillmantle Bug","Insects that hoard honey with heat-relieving
properties in the casing on their backs. They
ferment plants with cooling components.","","","","","","3DA42AD4-8501-4679-8E8D-43162CF67C27","","","3C2E8B55-43F2-41C1-BA79-BF470FC6CF80","An insect that wraps itself in a case of
plant matter. The case has a mucus that
protects it from high temperatures.","5752AEC9-5EB6-4E53-8233-B30959611780","Insects that live in extremely hot
environments. They wrap themselves in a
case of plant matter—much like their mantle
bug brethren—but the plants they use have
cooling properties, allowing them to
withstand heat. They are able to survive
without the casing by burrowing
underground.","BB434B91-7767-4D3E-9355-F7750F34B105","","00000000","","","",CellImage,CellImage,"I_SKY",true,false,false,false,"INVALID","ENVIRONMENT_TRAP","ALWAYS","INSTANT"
69,"EM5005_20_0","","Heatmantle Bug","Insects that hoard honey with cold-relieving
properties in the casing on their backs. They
ferment plants with heating components.","","","","","","E19685CD-B79A-4888-B1FE-9DC551065C55","","","1D774F41-EF44-487D-BE19-ACE8EFF97C76","An insect that wraps itself in a case of
plant matter. The case has a mucus that
protects it from low temperatures.","39986EE1-0FA9-4EBB-AE19-EF66FB7223D8","Insects that live in extremely cold
environments. They wrap themselves in
plant matter—much like their mantle bug
brethren—but they use plants with heating
properties, such as hot peppers, to
mitigate the cold. They can live on the
surface thanks to this, but if uncloaked
they must burrow underground to survive.","A478501A-972E-4D10-9F70-10642CDD7696","","00000000","","","",CellImage,CellImage,"I_ORANGE",true,false,false,false,"INVALID","ENVIRONMENT_TRAP","ALWAYS","INSTANT"
70,"EM5006_00_0","","Wiggly Litchi","Insects that thrive in rotting wood and soil.
Highly nutritious, they can be consumed to
increase stamina and halve its depletion rate.","","","","","","D73B240B-A115-48A3-BAB1-70B15660634F","","","6F483714-F685-4EEE-BD18-0D04A41EF3B9","Insects that thrive in rotting wood and soil.
Even monsters consume them because of their
high nutritional value.","E741A917-B05E-4849-8A56-3539C2BC5015","Insects that thrive in rotting wood and
soil due to their diet of plants and
rotting leaves. Consuming them will
increase stamina and halve its depletion
rate. Their high nutritional value makes
them a common snack for some monsters.","CD998F14-743C-457A-9BFD-0B2D4DFBC565","","00000000","","","",CellImage,CellImage,"I_IVORY",true,false,false,false,"INVALID","ENVIRONMENT_TRAP","ALWAYS","INSTANT"
71,"EM5007_00_0","","Dark Hornet","Nocturnal hornets that use a luminous organ to
warn foes before attacking with their stingers—
even large monsters aren't safe.","","","","","","144D145E-207E-4EED-86AA-446DFF1EC8B7","","","05922441-43E6-4357-9069-1BB9EBFAB6E9","Nocturnal, territorial hornets that use a
luminous organ to light up targets before
attacking with poison stingers.","4857582B-5AFE-4E3A-862A-74FF5F98343C","Nocturnal hornets with strong defensive
instincts. When they sense danger, they
use a luminous organ to illuminate the
area to check for threats, if one is spotted,
they attack relentlessly with their poisonous
stingers. Unlike other endemic life, Dark
Hornets will readily attack large monsters
that disturb their nests. Their diet also
doesn't stimulate honey production, so
hunters are better off steering clear.","136F80E4-3FB8-4A97-9228-CD990970E35B","","00000000","","","",CellImage,CellImage,"I_IVORY",true,false,false,false,"INVALID","ENVIRONMENT_TRAP","NONE","GET"
72,"EM5008_00_0","","Great Thunderbugs","A colony of Thunderbugs galvanized by
sandstorm lightning. A population this dense
can stop even large monsters in their tracks.","","","","","","F6CF893E-BC10-4058-B695-029784B41262","","","2C1009E6-8025-40F6-919E-F0C4D7F3F769","A large colony of Thunderbugs that have been
vitalized by the sandstorm's lightning,
resulting in a dense population.","74ADBFFE-35DE-4FB6-9BEB-D7450B639436","A large colony of Thunderbugs that
reproduced rapidly as a result of the
sandstorm lightning. A population this dense
can produce enough current to stop even
large monsters in their tracks. Since
Thunderbugs are the fuel behind shock traps,
there's merit to trying to lead large
monsters into the colony as a way to
gain the upper hand.","C864873F-2540-4F42-8C1A-3DF2D528C1CE","","00000000","","","",CellImage,CellImage,"I_YELLOW",true,false,false,false,"INVALID","ENVIRONMENT_TRAP","ALWAYS","INSTANT"
73,"EM5009_00_0","","Wedge Beetle","Insects that cling firmly to walls and other
surfaces. Latching on to them with the Slinger
can help you traverse terrain and evade attacks.","","","","","","2282166C-2573-4A95-8448-D7F5E6A71111","","","32E4C1F4-92C5-465F-A7CB-817C1CB5062C","Insects with robust shells that can
withstand lesser impacts. They make great
latching points for the Slinger.","6ABBB66D-862B-4835-8531-7B1508A020C9","Insects with robust shells that can
withstand most lesser impacts. They cling
firmly to walls and other surfaces, making
them excellent latching points for the
Slinger, whether it's to get around or
simply to hang out indefinitely. However,
a Wedge Beetle in flight can only bear
the weight for a limited time, so it's best
to latch on briefly to gain some height.","001C2829-80F9-447B-94D9-DB0826B7995D","","00000000","","","",CellImage,CellImage,"I_BLUE",true,false,false,false,"INVALID","ANIMAL","ALWAYS","UNIQUE"
74,"EM5100_00_0","","Thunderbug","Insects that store electricity. Found near
electrical sources, they can be used to make
tools like shock traps and Thunder Ammo.","","","","","","8E71A54A-59D9-493A-A155-3BEDF177F693","","","53CEFC29-B1DC-4841-94C6-C439A488AE28","Insects capable of discharging small amounts
of electricity. They are drawn to electrical
sources, which enhance them on contact.","CF117532-E567-427B-9A30-D0E23C404451","Insects capable of discharging small amounts
of electricity. They are drawn to electrical
sources, particularly the fulgurite formed
by lightning strikes. Thunderbug materials
can be used to craft many useful tools such
as shock traps and Thunder Ammo.","EA2450EC-1331-4BB8-8DF6-6B8D22663497","","00000000","","",CellImage,"",CellImage,"I_LEMON",true,false,true,true,"INVALID","COLLECT","EXCEPT_BATTLE","GET"
75,"EM5101_00_0","","Flashbug","Insects with apparatuses capable of
producing strong bursts of light. Their
materials are used in Slinger flash pods.","","","","","","B51BE3EF-FFED-4012-A2F0-5E5B254F5815","","","92A9D3D9-07CA-4610-8AD2-C10410BD7F33","Insects that emit strong, involuntary bursts
of light in response to external factors.","C3D19388-0ABE-4BF2-A8B8-DF753314E882","Insects that emit strong bursts of light in
response to external factors. It was long
believed that blunt trauma or death were the
triggers, but this theory has been rejected.
It is now thought that some constituent
element of their body fluid vaporizes and
produces the flash. In any case, their
materials are highly prized for their utility
in items like Slinger flash pods.","EFE3BD45-66BB-492E-BAD3-F402C109D44E","","00000000","","",CellImage,"",CellImage,"I_YELLOW",true,false,true,true,"INVALID","COLLECT","EXCEPT_BATTLE","GET"
76,"EM5101_10_0","","Godbug","Insects said to live for a thousand years. Their
extracts can be combined with other items to
create powders with their supportive properties.","","","","","","2904D242-B982-40AB-9D38-D5A62C68E136","","","81D4D7CD-502C-4D52-94E6-3EB713488D78","Insects that live a very long time—
a thousand years, by some accounts, although
no such specimens have been discovered.","AC93C6A3-BA85-4673-AD44-0798927DCDA1","Insects that are claimed by some tomes and
oral histories to live for a thousand years.
No such specimens have been discovered, but
studies of the Godbug's tissue prove that
they do enjoy significant longevity. Their
body fluids have diffusive properties that
can be combined with other items to create
powders with the same attributes.","48AD0F15-667C-41D1-8B87-0E77FBBC2055","","00000000","","",CellImage,"",CellImage,"I_WHITE",true,false,true,true,"INVALID","COLLECT","EXCEPT_BATTLE","GET"
77,"EM5101_20_0","","Bitterbug","Insects whose bitter extracts promote
natural healing and can be combined into
a variety of useful medicines and items.","","","","","","A5493B8D-23E0-472B-B7AC-A5272D7920FC","","","8B75ACD5-B1BD-4A8B-B1E8-BD74F7912D7C","Insects whose bitter extracts promote
natural healing, disinfect wounds, and more,
making them a valuable material.","B99992E8-0E67-4FF7-A878-0B24B98BE681","Insects whose bitter extracts are used
for a wide variety of medicinal purposes.
In addition to promoting natural healing,
disinfecting, and mitigating poisons,
they also boost the efficacy of other
medicines, making them highly useful.
That said, by themselves they have little
effect and taste extremely bitter, so
it's best to consider them an ingredient,
not a solution in their own right.","B3353BEC-CC3E-41F8-B834-6FDB44AC04F6","","00000000","","",CellImage,"",CellImage,"I_BLUE",true,false,true,true,"INVALID","COLLECT","EXCEPT_BATTLE","GET"
78,"EM5102_00_0","","Leaflugger Ant","Forest ants that form ranks and carry
leaves with medicinal properties, which
can be collected to make healing items.","","","","","","464FAE16-0FCF-4D55-9DBF-C02B0C1B5F18","","","70FFB94D-046C-431A-854B-3BFBF5183ACD","An ant that gathers leaves in droves. The
leaves are brought to its nest and used to
cultivate the fungi it eats.","BE2B594C-2BB3-497B-98B1-BAF7E836B472","Forest ants known for forming ranks and
carrying leaves. Their sharp mandibles
consist of a sharp edge for cutting and a
separate apparatus for bending the leaves
back behind their heads for easy carrying.
Leaflugger Ants use these leaves as
substrates to grow fungi, their primary
sustenance. As it turns out, the leaves also
have medicinal properties, making them
useful to hunters.","E1479BA3-E152-4F5E-A826-9758D1FBA14E","","00000000","","",CellImage,"",CellImage,"I_EMERALD",true,false,false,false,"INVALID","ANIMAL","EXCEPT_BATTLE","GET"
79,"EM5200_00_0","","Windrustler","Herding monsters that mostly inhabit the savannah.
They use their distinctive arrow-shaped crests to communicate
and warn other members of their herd of danger.","","","","","","BD59E00C-F908-4C35-8901-0E8AF9181DEB","","","66ECC911-8B4C-4EF2-A23A-34456F6D2B3F","Small, common plains dwellers with
arrow-like crests they use to coordinate
with others in their pack.","9ED1A45A-AEEE-4451-9D08-411669AABDA8","Plains dwellers that move in packs. They
use their arrow-like crests to coordinate
movements and alert each other to threats.
Since they stand their crests up when people
and monsters draw near, that gesture is
believed to indicate danger. Windrustlers
have been sighted in Kunafa, a sign that
they have learned two things: people aren't
always a threat...and where there's people,
there's food.","60BB2699-B4BF-4B42-A58E-AA04860666D8","","00000000","","",CellImage,"",CellImage,"I_WHITE",false,false,false,false,"INVALID","INVISIBLE","NONE","GET"
80,"EM5200_09_0","","Black Windrustler","","","","","","","22DE056D-511A-4BDB-B83F-52C86A14FBB1","","","CBE43487-5690-4789-ADAB-3B7C373249A9","A rare variant occasionally spotted in a
Windrustler pack. Distinguishable by their
charcoal skin and larger frame.","A7FCF3F7-FD66-4206-A900-DA926997A555","A rare variant occasionally spotted in
a Windrustler pack, with charcoal skin and
a larger frame. While it could be a type of
melanistic mutation, there are enough unique
examples to suggest this might even be
a subspecies. Their role in the pack and
relationship with others of their kind are
important topics that warrant further study.","1DB4D81A-D49F-46D8-AC55-DFBDFF986056","","00000000","","",CellImage,"",CellImage,"I_WHITE",false,false,false,false,"INVALID","INVISIBLE","NONE","GET"
