112,"EM5218_00_0","","Dapperwing","","","","","","","1CE0319B-67DA-443C-A3D7-B5008248FB54","","","7E3FAC45-D344-405A-A790-9463E4BACD9A","A species noted for its males who
grow spectacularly colorful plumage
after their molt to court females.","30F02215-F956-4692-9F79-D3470AF24612","A species noted for its males, who don
spectacularly colorful plumage after
molting. During the Fallow, their plumage is
a subdued green to match the vegetation, but
once the Plenty arrives, males preen to the
nines, adopting a vibrant color palette—
presumably to court females, since the more
flamboyant males with larger feathers seem
to be the ones flapping away with a date.","A4DFF22A-412E-405A-9634-17CA70C72231","","00000000","","",CellImage,"",CellImage,"I_MOS",false,false,false,false,"INVALID","INVISIBLE","NONE","GET"
113,"EM5218_09_0","","Dazzlewing","","","","","","","5B4D9EA9-864D-47DE-A2A9-9FCD6531BEAA","","","29D79757-27FA-44FD-8A59-9FCDABA5D6DB","Male Dapperwings with bigger tails, brighter
plumage, and some pretty good odds when
it comes to courting the females.","0590C6D9-7C50-4058-A89A-931BA42CE657","Male Dapperwings with bigger tails, brighter
plumage, and some pretty darn good odds when
it comes to courting the females. Not only
that, it is believed the plumage the males
achieve after molting plays a vital role in
what traits they pass on to their offspring.","6FE1455C-C135-4F6E-B6E5-89BF855E78D4","","00000000","","",CellImage,"",CellImage,"I_MOS",false,false,false,false,"INVALID","INVISIBLE","NONE","GET"
114,"EM5219_00_0","","Sandstar","","","","","","","4BF9DBA0-F518-41F7-A81D-A277CF0EAAE0","","","FAB9B6BB-2B82-4666-9AED-1EC6AD2C4950","Nocturnal creatures that live in the desert.
They are extremely wary and use acute
hearing to detect and flee from threats.","9FEC7570-F5D9-4C52-9388-D7E7CA36B6E4","Nocturnal desert creatures with pale,
luminescent fur that is believed to be the
result of the insects they primarily feed on.
Highly vigilant, they use their excellent
hearing to detect approaching threats and
flee, so trying to chase one down is the
wrong approach. You'll have a far easier
time catching one if you use a sonic bomb
to disrupt its hearing.","0624D38C-E434-4E6D-A133-13DBD3CF56C0","","00000000","","",CellImage,"",CellImage,"I_MOS",false,false,false,false,"INVALID","INVISIBLE","NONE","GET"
115,"EM5220_00_0","","Scalebat","","","","","","","7CCF0FAA-A5B1-4426-8746-EEDAED6F6ABC","","","7430E854-80AF-44BE-838B-5671032CD52B","A creature that is thought to have
originally been a wyvern but
evolved to live in caves like a bat.","059C9BDF-9084-41B5-86A1-D0C1C8F49C92","Creatures that greatly resemble bats. They
hang from the ceiling in dark places like
caves, and become active at night, preying
on insects and smaller flying creatures.
They can also be found in forests. Because
of characteristics like their scales, it is
theorized that they may have evolved from
wyverns. Huge colonies live in caves in the
Oilwell Basin, as evidenced by the piles
of dung found there.","2DC1C00D-006A-4CAC-82B6-D75AC200A37D","","00000000","","",CellImage,"",CellImage,"I_MOS",false,false,false,false,"INVALID","INVISIBLE","NONE","GET"
116,"EM5221_00_0","","Sparklerjelly","","","","","","","A2351781-2441-427E-AC09-7FA74158EE80","","","DA3C23D5-41B5-40D8-99C4-BC7AC54B0917","A jellyfish that floats in the air, preying
upon airborne microbes.","C081C0FC-E6E1-43A5-BF81-3A3E7538374E","Jellyfish that float in the air. Often seen
around the Coral Highlands in the New World.
Environments that contain the airborne
microbes they feed on and the air currents
they use to get around are quite rare.
Because the yellow ones found in the Oilwell
Basin are all male and the larger, more
colorful Peony Sparklerjelly are all female,
it is theorized that they actually belong to
the same species.","6AB20AF0-0D3A-42E5-940D-1D930E68767E","","00000000","","",CellImage,"",CellImage,"I_MOS",false,false,false,false,"INVALID","INVISIBLE","NONE","GET"
117,"EM5221_09_0","","Peony Sparklerjelly","","","","","","","AF195A88-94C5-4CEA-9433-30C77F34DB99","","","784BFDF8-8CC8-4486-81B3-E9D0A8331126","A larger, rarer jellyfish that floats
in the air.","A151ABA3-6C65-481B-8044-85C2AE99CD9D","Jellyfish that float in the air. They are
larger and more colorful than their yellow
brethren. The tiny beads of light within
them are actually eggs and larvae, so it's
believed that these creatures are entirely
female. This suggests that they belong to
the same species as the yellow Sparklerjelly,
which are entirely male. That being said,
it's exceptionally rare for jellyfish to have
such extreme differences between sexes.","E7A523C6-F360-40A9-9ADF-7FF0FABEF5BD","","00000000","","",CellImage,"",CellImage,"I_MOS",false,false,false,false,"INVALID","INVISIBLE","NONE","GET"
118,"EM5222_00_0","","Nu Yaya","","","","","","","13E3C81B-7471-4871-80A0-9EF71C878DD5","","","E0D00546-F292-4E99-ABC2-3E9DE3E73FD3","The larva of a Nu Udra. Can be found
floating in the area at certain times.","FD8191C7-A517-40CB-A8C0-36F42CC56E72","The larva of a Nu Udra. Though a fully grown
Nu Udra hadn't been seen in a long time,
there have been glimpses of this larval form.
Not much is known about their breeding
cycles, but it seems many eggs will hatch at
once, meaning groups of the creature are not
uncommon. The distinctive pattern on their
heads appears to hide an underdeveloped
eyeball and seems to grow into better
support of the eye.","2F264235-D96A-483D-B4C5-915E1B54411D","","00000000","","",CellImage,"",CellImage,"I_MOS",false,false,false,false,"INVALID","INVISIBLE","NONE","GET"
119,"EM5222_10_0","","Xu Yo","","","","","","","3444F434-26BB-4A21-80E6-50690A1F7E63","","","66A1A1B0-03E1-436A-9290-AD188C4D4945","Xu Wu larvae. Their skin is transparent, and
features a pattern unique to each specimen.","E715565F-D68B-4672-AD4A-970017805E1F","Xu Wu larvae, newly hatched from their eggs.
They already give off a faint luminescence,
and patterns can be seen through their thin,
transparent skin. They generally move in
groups, but not in an organized manner—
it's only because they hatched at the same
time. After hatching, the nutrients from
their eggs sustain them for a while. Beyond
that, their diet remains unknown.","68B4C07D-74B3-48EF-B072-FC30781A28EF","","00000000","","",CellImage,"",CellImage,"I_MOS",false,false,false,false,"INVALID","INVISIBLE","NONE","GET"
120,"EM5223_00_0","","Solanaria","","","","","","","E2DC5C42-6D85-4B2A-BDF6-10B88201B72B","","","B60277FE-58C6-4454-9CAC-164CE7FD2573","Creatures with fins that help them move
through the air. They're delicate but have
tremendous regenerative capabilities.","F1D2A12E-1B06-4B01-8A8A-FF31D1652204","Creatures with rippling fins on both sides
of their body that help them move through
the air. The fins possess a sort of
circulatory system, similar to blood
vessels, that give off light. Because their
bodies are so fragile, even the slightest
shock or gust of wind can tear them apart.
Their regenerative abilities make up for
this, however, as each piece becomes
a separate individual.","6F766F2A-71E8-46D9-A1F4-58EC0C50C703","","00000000","","",CellImage,"",CellImage,"I_MOS",false,false,false,false,"INVALID","INVISIBLE","NONE","GET"
121,"EM5224_00_0","","Pillopod","","","","","","","443D5D82-DD0B-40A5-80F5-A4F106053E37","","","946172C7-F276-4363-B048-FBC10D952115","Creatures that survive by attaching to the
Wyrmway, using energy-receptive organs along
their abdomens to harvest its energy.","19108325-8CC3-4A0A-978A-78AE05B62EAA","Creatures that survive by attaching to the
Wyrmway, using energy-receptive organs along
their abdomens to harvest its energy. This
specialized adaptation, and its other traits
that are consistent with ancient organisms,
makes this species a fascinating subject of
study. For example, their vision and nervous
systems are highly developed for such a
simple body structure, a detail that invites
further investigation.","3C3F6D8B-3A5D-4992-B35B-6A4CE4438B1B","","00000000","","",CellImage,"",CellImage,"I_MOS",false,false,false,false,"INVALID","INVISIBLE","NONE","GET"
122,"EM5224_09_0","","Gillopod","","","","","","","0D649BF6-B51B-45F6-ABD6-AA81515E4207","","","FF9B0E8F-C794-41A6-BE13-B1D985C6F7A5","A special type of Pillopod with a larger
body and prominent, expanded energy
circulation system.","69395DBA-5116-4547-9F9F-D71716C4D042","A special type of Pillopod with a larger
body and prominent, expanded energy
circulation system. Their eyes are
compressed, suggesting a mutation caused
by excessive energy intake. However,
considering how little is known about
ordinary Pillopods, these mysteries may
take some time to elucidate.","E93C6504-C2B7-448D-A4AA-3065C7DB26F3","","00000000","","",CellImage,"",CellImage,"I_MOS",false,false,false,false,"INVALID","INVISIBLE","NONE","GET"
123,"EM5225_00_0","","Petalfly","","","","","","","83B6F468-F09C-4176-B22E-C451DE1B2DB8","","","F3D64ED3-F0C6-4389-9041-1CE7CCF29415","Insects found in abundance in the Ruins
of Wyveria. While they are poor fliers,
they use the wind to get around. ","90A7A410-F9C4-44F1-9F39-0E1A63E390C5","Insects found in areas with ample vegetation
such as the heart of the Ruins of Wyveria.
Petalflies have poor flight capabilities,
but they can still use the wind to get
around. The larvae live in water or on moist
ground until they mature, while an adult's
short life span is spent reproducing. It has
been suggested that the flowery fragrance
the Petalflies give off may be a pheromone
linked to mating.","F282F3EB-F6BD-4E8B-B097-4DD959C1D2D3","","00000000","","",CellImage,"",CellImage,"I_MOS",false,false,false,false,"INVALID","INVISIBLE","NONE","GET"
124,"EM5226_00_0","","Downy Crake","","","","","","","B67A740A-24FE-40CA-85FE-3C83BB72224B","","","A606A439-1537-4873-8BFC-34742D1B4B37","Birds that can be sighted riding on the
backs of small monsters. They are extremely
wary of threats and are quick to flee,","E8F460FC-8336-4FE9-BD81-F989B21393A7","Birds that can be sighted riding on the
backs of small monsters. They are extremely
wary of external threats and are quick to
flee, making them difficult to capture.
Their disproportionately long legs allow
them to move at high speeds. Populations
have been observed living in some human
settlements, allowing their eggs to be
gathered in an extremely unusual symbiotic
relationship.","18C5806F-CF95-416A-9492-4461D1969E2F","","00000000","","",CellImage,"",CellImage,"I_MOS",false,false,false,false,"INVALID","INVISIBLE","NONE","GET"
125,"EM5300_00_0","","Starduster","A small fish that moves in large schools. It is common
in bodies of water of the Windward Plains and the Forest.
Notable for its bright, reflective blue and gold scales.","","","","","","693D41DA-4208-47C7-BB25-569B35E4C3C9","","","EF91E08F-85A0-414E-86C0-FC604F78401E","A small fish that is common prey for many
creatures and prefers to live in schools.
The schools can become impressively large.","9B80DDA3-3DE5-48A2-A584-ED9DBCD23F37","Small fish with blue and yellow scales that
prefer to live in schools. The sizes of
these schools vary and at times can become
impressively large. Because they both breed
rapidly and exist in large numbers, they are
frequently preyed upon, making them the
backbone of the ecosystem. Splashes on the
surface of bodies of water are a sign of
this fish fleeing from large predators.","50DD04A9-E7D8-4AB4-B53D-8AB24ADD652B","","00000000","","",CellImage,"",CellImage,"I_SKY",false,false,false,false,"INVALID","INVISIBLE","NONE","GET"
126,"EM5300_10_0","","Starduster","","","","","","","252B9950-12A6-44EF-BA10-529CAA0DD0C8","","","BF6ACB0E-D265-40E2-827A-4037166488E1","","EA5FC2FA-2F2C-42F1-87FB-1EFDDAA7A03B","","7340818D-587A-4D7F-8F6F-A1E1A18E02FC","","00000000","","",CellImage,"",CellImage,"I_SKY",false,false,false,false,"INVALID","INVISIBLE","NONE","GET"
127,"EM5301_00_0","","Virid Bowfin","A fish whose physiology remains almost
unchanged from its ancient ancestors.
Its spiny fins help ward off predators.","","","","","","2E583C35-42D8-4743-A083-F9455D950A97","","","F68EA078-8605-49B1-B391-0CBB84E8F967","A species endemic to the Eastlands. They are
more common in warm areas and are noted for
their bright green bodies.","EECA0C99-1DE3-4CB5-A953-DACE89B68D04","A species endemic to the Eastlands. They are
more common in warm areas, suggesting
that they have adapted to more temperate
climates. Compared to other fish, Virid
Bowfins are neither particularly useful nor
suitable for eating, so anglers tend to
treat them as bycatch. On the other hand,
they have high scientific value because they
exhibit unique traits not seen outside their
Eastland habitat.","172D925D-434F-47F8-BD82-7CBC82E308F4","","00000000","","",CellImage,"",CellImage,"I_EMERALD",false,false,false,false,"INVALID","INVISIBLE","NONE","GET"
128,"EM5302_00_0","","Whetfish","A fish with a dorsal fin
hard enough to be used
to sharpen weapons.","","","","","","28B839EB-17EF-4CD3-A083-691EA3BD0046","","","21A75EB9-5357-4535-BF88-9C4348E9403E","Fish with scales and fins hard enough to surpass
common whetstones. The fins in particular are
frequently used for sharpening.","9792E5FE-E7A2-46DD-8F4B-BD6124E489A7","Fish covered with scales and fins of
considerable durability. In fact, Whetfish
are so hard that they are often used in
place of common whetstones to sharpen
weapons. It is believed these hardened
features evolved as a defense mechanism
against predators. They show a strong
interest in Emerald Jitterbait.","5D8AB162-B1AA-4DF2-B0C3-61AF61F7E265","","00000000","","",CellImage,"",CellImage,"I_YELLOW",false,false,false,false,"INVALID","INVISIBLE","NONE","GET"
129,"EM5303_00_0","","Sushifish","Sushifish are a popular hunter staple.
Their nutrient-rich scales can also be
used to restore health.","","","","","","1DE20065-A64F-4365-A4E0-B67FE262D2CF","","","38C94B32-BDCF-4585-8279-918C83B88E79","A popular food source high in nutrition.
Their scales are capable of restoring
health.","838B39F5-CDBE-4130-8ABB-0B5D818F3F9F","A popular food source found in many
a hunter's pouch, these fish have very
high nutritional value—not just in their
flesh, but their scales too. They offer
a remarkable range of benefits, including
health and bleeding recovery, and stamina
boosts. Because of this, Sushifish are common
prey for many aquatic species. They show
a strong interest in Emerald Jitterbait.","E9148DF0-AECC-4FC0-9F98-D900E5B261A7","","00000000","","",CellImage,"",CellImage,"I_ORANGE",false,false,false,false,"INVALID","INVISIBLE","NONE","GET"
130,"EM5304_00_0","","Gastronome Tuna","","","","","","","B5078911-2245-46F6-B5B2-76E63844BB14","","","3E123903-4220-4B4D-A2D1-1AFAC8AF948F","Large fish with a habit of gobbling up
everything they see—including a hunter's
tools.","58AE4EC0-38D7-4A4A-B340-BAC8B9FE9750","Large fish that gobble up anything and
everything they can swallow, including
things a hunter might use for tools.
Gastronome Tuna are commonly observed
during the season of Plenty, when smaller
fish are abundant. Food is scarce during
the Fallow, however, so sightings become
rare as they move to more fruitful feeding
grounds. They show a strong interest in
Tuff Joint Bait.","51E078E4-6F60-4C6C-B936-26C861F36ED4","","00000000","","",CellImage,"",CellImage,"I_ULTRAMARINE",false,false,false,false,"INVALID","INVISIBLE","NONE","GET"
131,"EM5305_00_0","","Gajau","","","","","","","19509C4E-0D33-4E9C-91B3-0E6D936D0C12","","","2D89354A-64B5-4EED-BE19-55825C5CCAA4","Fish with flat heads, broad mouths, and
long whiskers. They are known to grow
to a considerable size.","1CA92AB3-AE02-49F7-97C9-1E0A202B7030","Large fish with flat heads, broad mouths,
and long whiskers. They are known to grow
to a considerable size—some as large as
a human. While an Eastland Gajau is wary
and will flee from a perceived threat, there
have been documented Gajau attacks in other
parts of the world. Researchers link such
differences in behavior to habitat. Gajau
show a strong interest in Duster Rigs.","5AA065E6-904D-445C-8C1E-CCDE08A9D1D3","","00000000","","",CellImage,"",CellImage,"I_BROWN",false,false,false,false,"INVALID","INVISIBLE","NONE","GET"
132,"EM5306_00_0","","Goldenfry","","","","","","","38DC6F5B-62CC-494E-A51B-B02C7FD44484","","","B5EDFC98-4D69-441B-90E2-AE679ED20E50","Sparkly fish often found in slow currents.
They are in high demand for aquariums,
and their scales fetch a pretty zenny, too.","B9B682E2-6E2E-410B-A7E7-AF94310D6A52","Due to their sparkly appearance, Goldenfry
are in high demand as aquarium fish, and
their scales fetch a pretty zenny as well.
Their distinctive traits—the short body, the
long, broad fins—are not commonly seen in
nature, leading some researchers to believe
an anthropogenic factor might be at play.
Goldenfry show a strong interest in Golden
Bugheads.","480AC285-7FD3-4FBB-86E4-86A11EB762A9","","00000000","","",CellImage,"",CellImage,"I_YELLOW",false,false,false,false,"INVALID","INVISIBLE","NONE","GET"
133,"EM5307_00_0","","Goldenfish","","","","","","","4770DAB4-C347-4ABB-B94E-A21EDC354720","","","1A70F577-616A-4F95-9CFE-227AB85E67E8","Fish with stunning golden scales covering
their bodies. Their scales fetch high prices
as accessory materials.","740D412C-EE31-4054-B183-A39CD4695A15","With the stunning golden scales covering
their bodies, it's no wonder these fish are
aquarium staples and often sell for high
prices for use in accessories. Goldenfish
can be found in caves and other places with
no sunlight and calm waters. Conversely,
you will rarely see them out in the sun or
in swift currents. They show a strong
interest in Golden Bugheads.","5E3D96CC-26AF-4A7F-A5D6-58173ACF8C79","","00000000","","",CellImage,"",CellImage,"I_YELLOW",false,false,false,false,"INVALID","INVISIBLE","NONE","GET"
134,"EM5308_00_0","","Platinumfish","","","","","","","08852E29-A57C-4255-821C-44E01CEB1F36","","","0A4969B5-8E2D-4D7F-A1B0-BBA2C890A316","Fish covered with platinum-colored scales.
Some theorize they are related to Goldenfish
due to their similar appearance and habits.","9C55B438-C60D-4FF9-AC72-4441227066D3","Fish covered with platinum-colored
scales. Like the Goldenfish, they are
a popular feature in aquariums and
accessories—but at higher prices,
because of their relative scarcity. The
leading theory for the Platinumfish's
unique coloring is that they adapted
to their sunless cave environments.
They show a strong interest in Golden
Bugheads.","84B644CD-2FC3-4A7F-8405-8F016B7FBFB8","","00000000","","",CellImage,"",CellImage,"I_WHITE",false,false,false,false,"INVALID","INVISIBLE","NONE","GET"
135,"EM5309_00_0","","Burst Arowana","","","","","","","77B11124-723F-438D-BE8D-F907F33501CE","","","EE9C65EE-6066-41B7-832D-CC345DC75E2F","Fish that possess scales with explosive
properties. Useful for crafting items like
bowgun ammo.","54618184-5C20-4CF1-93F6-5996D7A4EAB9","Fish with scales that detonate, a property
that allows them to be crafted into things
like bowgun ammo. How the Burst Arowana
came to be this way is an unsolved mystery,
and the debate rages on; some theorize it
was an inherent trait, others that it was
acquired through feeding habits. Burst
Arowana show a strong interest in Emerald
Jitterbait.","C769E73D-B0D6-47A1-ADFE-36EB6A33AB9E","","00000000","","",CellImage,"",CellImage,"I_RED",false,false,false,false,"INVALID","INVISIBLE","NONE","GET"
136,"EM5310_00_0","","Bomb Arowana","","","","","","","924B2DE3-A0AB-42B5-AEC3-AECE233FA9C7","","","4190E36F-AB5D-4883-84A1-EC4F5DD2353A","Fish with scales that trigger a powerful
explosion, making them great material for
potent bowgun ammo.","184A7714-2EF8-4029-8AC1-751EB8542204","Fish with scales that detonate even more
powerfully than the Burst Arowana's, making
them great material for potent bowgun ammo.
The Burst and Bomb Arowana's relationship is
disputed. Is the latter a subspecies? Should
the difference be chalked up to habitat?
Researchers are confident that this line of
questioning will eventually reveal the
fishes' explosive secrets. Bomb Arowanas
show a strong interest in Emerald Jitterbait.","9C1776C9-D819-47EC-BA7F-E234195D233B","","00000000","","",CellImage,"",CellImage,"I_RED",false,false,false,false,"INVALID","INVISIBLE","NONE","GET"
137,"EM5311_00_0","","Gunpowderfish","","","","","","","159942B9-3B6F-43B4-9542-962BA91E44AF","","","5E1E082D-8A58-4FF3-87B1-4257B1B73B47","Fish that have large, protruding eyes on
either side of their heads and explosive
scales that are useful in bomb-making.","2C777C60-79BE-40CA-BAA0-A8F86F08D36B","Fish that have explosive scales useful in
bomb-making. The large, protruding eyes they
have on both sides are rarely seen in nature,
prompting some to theorize that the species
evolved through human manipulation, only
to become wild sometime later. Gunpowderfish
show a strong interest in Emerald Jitterbait.","06582888-37D8-4079-B16E-429728223B77","","00000000","","",CellImage,"",CellImage,"I_RED",false,false,false,false,"INVALID","INVISIBLE","NONE","GET"
138,"EM5312_00_0","","Speartuna","","","","","","","94C15075-8753-4537-BEB7-2DCEFC3CAF8D","","","3D0B1E6B-5A4B-4AAA-8C72-8BE47F119F1C","Large fish characterized by the long rostra
extending from their heads. Seen often
during Fallows, but absent during Plenties.","CC0716D9-5177-4C44-B790-CA0A69A59D16","Large fish characterized by the long rostra
extending from their heads. The rostra are
used to catch prey and defend against
enemies. Speartuna are a common sight
during the Fallow, but absent during the
Plenty. It is believed that they avoid
competing with other large fish over the
abundant food. Speartuna show a strong
interest in Tuff Joint Bait.","0C36A16F-E6B1-48EF-971C-01A848A8366E","","00000000","","",CellImage,"",CellImage,"I_ULTRAMARINE",false,false,false,false,"INVALID","INVISIBLE","NONE","GET"
139,"EM5313_00_0","","Petricanths","","","","","","","27B189A9-F38E-4134-8BA9-133AD74EEAC3","","","1B5B1470-1C7E-40EB-AC94-C0DC0C5EB4BC","So few of these fish have been found alive
that they were once thought to be extinct.
They retain the same form as in ancient times.","FF1262C1-462F-41B4-A413-2F5C96E26151","So few of these fish have been found alive
that they were once thought to be extinct.
At one point, they only turned up as fossils
—and in a way, they <ITALIC>are</ITALIC> living fossils
since they retain the same form as in
ancient times. Research on the ecology
of the Petricanths might just elucidate
how other prehistoric organisms lived.
Petricanths show a strong interest
in Duster Rigs.","F32B4E33-A88C-439B-B850-3838653A23F2","","00000000","","",CellImage,"",CellImage,"I_SKY",false,false,false,false,"INVALID","INVISIBLE","NONE","GET"
140,"EM5314_00_0","","Glass Parexus","","","","","","","66C20025-2242-4E53-8058-B258D6E29460","","","E2A236C5-C850-48EB-AD36-CDCF0A426443","Fish with transparent bodies, a protective
measure to conceal themselves from
predators. They prefer colder habitats.","B138A02B-F7D8-4FE5-96C3-25A8938391D8","Fish with transparent bodies that reveal
their bones and organs. This protective
coloration—or lack thereof, rather—hides
them from predators. Glass Parexus prefer
colder regions, and are often found in clear
waters where their transparency is most
effective.","2880D005-BF06-4F75-9A8C-053AF5CCCA4C","","00000000","","",CellImage,"",CellImage,"I_WHITE",false,false,false,false,"INVALID","INVISIBLE","NONE","GET"
141,"EM5315_00_0","","Goliath Squid","","","","","","","2EB1F154-1C69-4C89-AA62-0E96278B3867","","","D316F001-499A-432E-8CC8-364DAF8ACDCA","Huge nocturnal aquatic creatures with long
tentacles. Their bodies glow as they swim
around at night.","035CD876-1203-4542-8DA6-BE094A28E530","Huge nocturnal creatures that have eight
short legs, two long tentacles, and
distinctive patterning on their bodies.
Goliath Squids use special luminescent
organs to light up their whole body, scaring
off enemies and hunting prey. Some believe
it might also be a way for them to
communicate with each other. They show
a strong interest in Tentacle Jigs.","74BFB45E-9D36-4FA7-A531-EEF62ACF941E","","00000000","","",CellImage,"",CellImage,"I_WHITE",false,false,false,false,"INVALID","INVISIBLE","NONE","GET"
142,"EM5316_00_0","","Great Trevally","","","","","","","E7CA0198-FFFD-4511-93C1-A9FD8879B642","","","F69DC79B-23FA-4FA0-A031-7ECFB7F1DB53","Large fish notable for their sizeable
mouths, which can gobble down large prey
in one gulp.","B690E72C-1B41-4CE0-82B1-10317D47FC09","Large fish notable for their sizeable mouths,
which can gobble down most small- to medium-
sized prey in one go. Great Trevally are
diurnal and have a wide range of habitats.
Smaller specimens can even be found in the
shallows. They show a strong interest in
Tuff Joint Bait.","950469ED-C1BA-467D-8AB4-21A964169505","","00000000","","",CellImage,"",CellImage,"I_MOS",false,false,false,false,"INVALID","INVISIBLE","NONE","GET"
143,"EM5317_00_0","","Escunite","","","","","","","60D6215B-1D92-4AE2-9408-483B32075786","","","AE2643DE-9C7A-4C9D-800D-B72F92C2BA15","Creatures with exceptionally hard shells that
keep the majority of their bodies hidden from
predators.","243BEF14-8AFB-4AC6-AACC-15BBB8674EB9","Creatures with exceptionally hard shells
that keep the majority of their bodies
hidden from predators. Their numerous
tentacles draw in and catch prey. Escunites
move by expelling water from organs called
siphons that are hidden inside their
tentacles. They show a strong interest in
Tentacle Jigs.","776B27ED-4C10-4C65-B4FE-86768729ABC7","","00000000","","",CellImage,"",CellImage,"I_MOS",false,false,false,false,"INVALID","INVISIBLE","NONE","GET"
